{
  "$schema": "https://json-schema.org/draft/2020-12/schema",
  "type": "object",
  "additionalProperties": false,
  "required": [
    "schema",
    "reviews",
    "template",
    "rows",
    "actions"
  ],
  "properties": {
    "schema": {
      "const": 2,
      "type": "integer"
    },
    "template": {
      "type": "array",
      "minItems": 1,
      "items": {
        "type": "string"
      }
    },
    "reviews": {
      "type": "array",
      "minItems": 1,
      "items": {
        "$ref": "#/$defs/review"
      }
    },
    "rows": {
      "type": "array",
      "minItems": 1,
      "items": {
        "$ref": "#/$defs/row"
      },
      "contains": {
        "type": "object",
        "required": [
          "id",
          "tool",
          "reviews"
        ],
        "properties": {
          "id": {
            "const": "Verilator"
          },
          "tool": {
            "const": "Verilator"
          },
          "reviews": {
            "contains": {
              "const": "verilator"
            }
          }
        },
        "$comment": "The enforced RTL release must keep its licence-review row even when other tools remain; this preserves the missing-row refusal formerly owned by K-97."
      }
    },
    "actions": {
      "type": "array",
      "minItems": 1,
      "items": {
        "$ref": "#/$defs/action"
      }
    }
  },
  "$defs": {
    "review": {
      "type": "object",
      "additionalProperties": false,
      "required": [
        "id",
        "tool",
        "subject",
        "reviewed",
        "owners"
      ],
      "properties": {
        "id": {
          "type": "string",
          "pattern": "^[a-z][a-z0-9_]*$"
        },
        "tool": {
          "type": "string",
          "minLength": 1
        },
        "subject": {
          "type": "string",
          "minLength": 1
        },
        "reviewed": {
          "type": "array",
          "minItems": 1,
          "uniqueItems": true,
          "items": {
            "type": "string",
            "minLength": 1
          }
        },
        "owners": {
          "type": "array",
          "minItems": 1,
          "uniqueItems": true,
          "items": {
            "$ref": "#/$defs/owner"
          }
        }
      }
    },
    "owner": {
      "type": "object",
      "additionalProperties": false,
      "required": [
        "kind",
        "path",
        "key"
      ],
      "properties": {
        "kind": {
          "enum": [
            "uv",
            "uv-required",
            "opam",
            "opam-pin",
            "opam-every",
            "opam-any",
            "assign",
            "shell",
            "pip",
            "pre-commit",
            "pre-commit-rev",
            "python"
          ]
        },
        "path": {
          "type": "string",
          "minLength": 1
        },
        "key": {
          "type": "string",
          "minLength": 1
        }
      }
    },
    "row": {
      "type": "object",
      "additionalProperties": false,
      "required": [
        "id",
        "tool",
        "license",
        "standing"
      ],
      "properties": {
        "id": {
          "type": "string",
          "minLength": 1
        },
        "tool": {
          "type": "string",
          "minLength": 1,
          "not": {
            "pattern": "[\\r\\n|]"
          }
        },
        "license": {
          "type": "string",
          "minLength": 1,
          "not": {
            "pattern": "[\\r\\n|]"
          }
        },
        "standing": {
          "type": "string",
          "minLength": 1,
          "not": {
            "pattern": "[\\r\\n|]"
          }
        },
        "reviews": {
          "type": "array",
          "minItems": 1,
          "uniqueItems": true,
          "items": {
            "type": "string",
            "minLength": 1
          }
        },
        "disposition": {
          "type": "string",
          "minLength": 1,
          "pattern": "\\S"
        }
      },
      "oneOf": [
        {
          "required": [
            "reviews"
          ],
          "not": {
            "required": [
              "disposition"
            ]
          }
        },
        {
          "required": [
            "disposition"
          ],
          "not": {
            "required": [
              "reviews"
            ]
          }
        }
      ]
    },
    "action": {
      "type": "object",
      "additionalProperties": false,
      "required": [
        "repository",
        "release",
        "commit",
        "license",
        "licence_paths",
        "description",
        "attribution",
        "notice"
      ],
      "properties": {
        "repository": {
          "type": "string",
          "pattern": "^[A-Za-z0-9_.-]+/[A-Za-z0-9_.-]+(?![\\s\\S])",
          "not": {
            "pattern": "(^|/)\\.{1,2}(/|$)"
          }
        },
        "release": {
          "type": "string",
          "pattern": "^v\\d+\\.\\d+\\.\\d+(?![\\s\\S])"
        },
        "commit": {
          "type": "string",
          "pattern": "^[0-9a-f]{40}(?![\\s\\S])"
        },
        "license": {
          "type": "string",
          "minLength": 1,
          "pattern": "^[A-Za-z0-9 .-]+(?![\\s\\S])"
        },
        "licence_paths": {
          "type": "array",
          "minItems": 1,
          "uniqueItems": true,
          "items": {
            "type": "string",
            "pattern": "^(?:[A-Za-z0-9_.-]+/)*[A-Za-z0-9_.-]+(?![\\s\\S])",
            "not": {
              "pattern": "(^|/)\\.{1,2}(/|$)"
            }
          }
        },
        "description": {
          "type": "string",
          "minLength": 1,
          "pattern": "^[A-Za-z0-9 ,.';()\\-]+(?![\\s\\S])"
        },
        "notice": {
          "type": "string",
          "minLength": 1,
          "pattern": "^[A-Za-z0-9 ,.';()\\-]+(?![\\s\\S])"
        },
        "attribution": {
          "type": "string",
          "minLength": 0,
          "pattern": "^[A-Za-z0-9 ,.';()\\-]*(?![\\s\\S])"
        }
      }
    }
  }
}
