{
  "schema": 2,
  "reviews": [
    {
      "id": "verilator",
      "tool": "Verilator",
      "subject": "the enforced RTL tool release",
      "reviewed": [
        "5.052"
      ],
      "owners": [
        {
          "kind": "assign",
          "path": "tools/vos/cli/rtl.py",
          "key": "VERILATOR_PIN"
        }
      ]
    },
    {
      "id": "node_js_1",
      "tool": "Node.js",
      "subject": "the reviewed release",
      "reviewed": [
        "26.12.0"
      ],
      "owners": [
        {
          "kind": "shell",
          "path": "tools/wasm-oracle/node.sh",
          "key": "node_version"
        }
      ]
    },
    {
      "id": "pre_commit_2",
      "tool": "pre-commit",
      "subject": "the reviewed release",
      "reviewed": [
        "4.7.0"
      ],
      "owners": [
        {
          "kind": "uv",
          "path": "tools/uv.lock",
          "key": "pre-commit"
        }
      ]
    },
    {
      "id": "zizmor_3",
      "tool": "zizmor",
      "subject": "the reviewed release and its licence tag",
      "reviewed": [
        "1.31.1"
      ],
      "owners": [
        {
          "kind": "uv",
          "path": "tools/uv.lock",
          "key": "zizmor"
        }
      ]
    },
    {
      "id": "actionlint_4",
      "tool": "actionlint",
      "subject": "the reviewed release and its licence tag",
      "reviewed": [
        "1.7.12"
      ],
      "owners": [
        {
          "kind": "shell",
          "path": "tools/ci/actionlint.sh",
          "key": "actionlint_version"
        }
      ]
    },
    {
      "id": "opam_5",
      "tool": "opam",
      "subject": "the reviewed release",
      "reviewed": [
        "2.6.1"
      ],
      "owners": [
        {
          "kind": "assign",
          "path": "tools/vos/opam_client.py",
          "key": "OPAM_VERSION"
        }
      ]
    },
    {
      "id": "z3_6",
      "tool": "Z3",
      "subject": "the reviewed release and its licence tag",
      "reviewed": [
        "5.3.1"
      ],
      "owners": [
        {
          "kind": "assign",
          "path": "tools/vos/env.py",
          "key": "Z3_VERSION"
        }
      ]
    },
    {
      "id": "quickchick_7",
      "tool": "QuickChick",
      "subject": "the pinned commit",
      "reviewed": [
        "3d4d6c0e9f72172a9f0b26db61c5496ec8e0f568"
      ],
      "owners": [
        {
          "kind": "opam-pin",
          "path": "tools/opam/quickchick.lock",
          "key": "coq-quickchick"
        }
      ]
    },
    {
      "id": "coq_simple_io_8",
      "tool": "coq-simple-io",
      "subject": "the pinned commit",
      "reviewed": [
        "d035c0a85f0bde4ad56c31a9fa9ef3cb5e8d0f18"
      ],
      "owners": [
        {
          "kind": "opam-pin",
          "path": "tools/opam/quickchick.lock",
          "key": "coq-simple-io"
        }
      ]
    },
    {
      "id": "coq_ext_lib_9",
      "tool": "coq-ext-lib",
      "subject": "the released version",
      "reviewed": [
        "0.13.2"
      ],
      "owners": [
        {
          "kind": "opam",
          "path": "tools/opam/quickchick.lock",
          "key": "coq-ext-lib"
        }
      ]
    },
    {
      "id": "rupicola_bedrock2_and_the_bedrock2__10",
      "tool": "Rupicola, Bedrock2, and the Bedrock2 compiler",
      "subject": "Rupicola's release",
      "reviewed": [
        "0.0.11"
      ],
      "owners": [
        {
          "kind": "opam",
          "path": "tools/opam/rupicola.lock",
          "key": "coq-rupicola"
        }
      ]
    },
    {
      "id": "rupicola_bedrock2_and_the_bedrock2__11",
      "tool": "Rupicola, Bedrock2, and the Bedrock2 compiler",
      "subject": "Bedrock2's and its compiler's release",
      "reviewed": [
        "0.0.9"
      ],
      "owners": [
        {
          "kind": "opam",
          "path": "tools/opam/rupicola.lock",
          "key": "coq-bedrock2"
        },
        {
          "kind": "opam",
          "path": "tools/opam/rupicola.lock",
          "key": "coq-bedrock2-compiler"
        }
      ]
    },
    {
      "id": "coqutil_12",
      "tool": "coqutil",
      "subject": "the switch's release",
      "reviewed": [
        "0.0.7"
      ],
      "owners": [
        {
          "kind": "opam",
          "path": "tools/opam/rupicola.lock",
          "key": "coq-coqutil"
        }
      ]
    },
    {
      "id": "riscv_coq_13",
      "tool": "riscv-coq",
      "subject": "the switch's release",
      "reviewed": [
        "0.0.6"
      ],
      "owners": [
        {
          "kind": "opam",
          "path": "tools/opam/rupicola.lock",
          "key": "coq-riscv"
        }
      ]
    },
    {
      "id": "compcert_in_the_oracle_s_switch_14",
      "tool": "CompCert, in the oracle's switch",
      "subject": "the CertiRocq snapshot's release",
      "reviewed": [
        "3.18"
      ],
      "owners": [
        {
          "kind": "opam",
          "path": "tools/opam/certirocq.lock",
          "key": "coq-compcert"
        }
      ]
    },
    {
      "id": "certirocq_15",
      "tool": "CertiRocq",
      "subject": "the CertiRocq snapshot's release",
      "reviewed": [
        "0.9.1+9.1"
      ],
      "owners": [
        {
          "kind": "opam",
          "path": "tools/opam/certirocq.lock",
          "key": "rocq-certirocq"
        },
        {
          "kind": "assign",
          "path": "tools/vos/gallina.py",
          "key": "CERTIROCQ_VERSION"
        }
      ]
    },
    {
      "id": "metarocq_16",
      "tool": "MetaRocq",
      "subject": "the CertiRocq snapshot's release",
      "reviewed": [
        "1.5.1+9.1"
      ],
      "owners": [
        {
          "kind": "opam",
          "path": "tools/opam/certirocq.lock",
          "key": "rocq-metarocq-utils"
        },
        {
          "kind": "opam",
          "path": "tools/opam/certirocq.lock",
          "key": "rocq-metarocq-common"
        },
        {
          "kind": "opam",
          "path": "tools/opam/certirocq.lock",
          "key": "rocq-metarocq-template"
        },
        {
          "kind": "opam",
          "path": "tools/opam/certirocq.lock",
          "key": "rocq-metarocq-pcuic"
        },
        {
          "kind": "opam",
          "path": "tools/opam/certirocq.lock",
          "key": "rocq-metarocq-template-pcuic"
        },
        {
          "kind": "opam",
          "path": "tools/opam/certirocq.lock",
          "key": "rocq-metarocq-safechecker"
        },
        {
          "kind": "opam",
          "path": "tools/opam/certirocq.lock",
          "key": "rocq-metarocq-safechecker-plugin"
        },
        {
          "kind": "opam",
          "path": "tools/opam/certirocq.lock",
          "key": "rocq-metarocq-erasure"
        },
        {
          "kind": "opam",
          "path": "tools/opam/certirocq.lock",
          "key": "rocq-metarocq-erasure-plugin"
        }
      ]
    },
    {
      "id": "wasmcert_coq_17",
      "tool": "WasmCert-Coq",
      "subject": "the CertiRocq snapshot's release",
      "reviewed": [
        "2.2.0"
      ],
      "owners": [
        {
          "kind": "opam",
          "path": "tools/opam/certirocq.lock",
          "key": "coq-wasm"
        }
      ]
    },
    {
      "id": "equations_18",
      "tool": "Equations",
      "subject": "the CertiRocq snapshot's release",
      "reviewed": [
        "1.3.1+9.1"
      ],
      "owners": [
        {
          "kind": "opam",
          "path": "tools/opam/certirocq.lock",
          "key": "rocq-equations"
        }
      ]
    },
    {
      "id": "the_certirocq_snapshot_s_rocq_libra_19",
      "tool": "The CertiRocq snapshot's Rocq libraries",
      "subject": "coq-ext-lib's release in the CertiRocq snapshot",
      "reviewed": [
        "0.13.2"
      ],
      "owners": [
        {
          "kind": "opam",
          "path": "tools/opam/certirocq.lock",
          "key": "coq-ext-lib"
        }
      ]
    },
    {
      "id": "the_certirocq_snapshot_s_rocq_libra_20",
      "tool": "The CertiRocq snapshot's Rocq libraries",
      "subject": "Flocq's release in the CertiRocq snapshot",
      "reviewed": [
        "4.2.2"
      ],
      "owners": [
        {
          "kind": "opam",
          "path": "tools/opam/certirocq.lock",
          "key": "coq-flocq"
        }
      ]
    },
    {
      "id": "the_certirocq_snapshot_s_rocq_libra_21",
      "tool": "The CertiRocq snapshot's Rocq libraries",
      "subject": "Mathematical Components's release in the CertiRocq snapshot",
      "reviewed": [
        "2.4.0"
      ],
      "owners": [
        {
          "kind": "opam",
          "path": "tools/opam/certirocq.lock",
          "key": "rocq-mathcomp-ssreflect"
        },
        {
          "kind": "opam",
          "path": "tools/opam/certirocq.lock",
          "key": "coq-mathcomp-ssreflect"
        }
      ]
    },
    {
      "id": "the_certirocq_snapshot_s_rocq_libra_22",
      "tool": "The CertiRocq snapshot's Rocq libraries",
      "subject": "Hierarchy Builder's release in the CertiRocq snapshot",
      "reviewed": [
        "1.10.3"
      ],
      "owners": [
        {
          "kind": "opam",
          "path": "tools/opam/certirocq.lock",
          "key": "rocq-hierarchy-builder"
        }
      ]
    },
    {
      "id": "the_certirocq_snapshot_s_rocq_libra_23",
      "tool": "The CertiRocq snapshot's Rocq libraries",
      "subject": "Rocq-Elpi's release in the CertiRocq snapshot",
      "reviewed": [
        "3.5.1"
      ],
      "owners": [
        {
          "kind": "opam",
          "path": "tools/opam/certirocq.lock",
          "key": "rocq-elpi"
        }
      ]
    },
    {
      "id": "the_certirocq_snapshot_s_rocq_libra_24",
      "tool": "The CertiRocq snapshot's Rocq libraries",
      "subject": "parseque's release in the CertiRocq snapshot",
      "reviewed": [
        "0.2.2"
      ],
      "owners": [
        {
          "kind": "opam",
          "path": "tools/opam/certirocq.lock",
          "key": "coq-parseque"